{"schema":"fpo.phase5c.resume-return.v1","case_id":"R4","generation_id":"R4-G1","work_id":"FPO-5C-R4","source_revision":"r3","decision":"RESUME","next_action":"propose-repair-from-persisted-evidence","observed_facts":[{"fact_id":"R4-F1","text":"persisted source-bound research evidence E-R4-RESEARCH-001 is already accepted; repair is not yet applied","source_refs":["phase5c/source/R4-immutable-r3.json","phase5c/evidence/E-R4-RESEARCH-001.json"]}],"used_source_refs":["phase5c/source/R4-immutable-r3.json"],"evidence_refs":["E-R4-RESEARCH-001"],"uncertainty_ids":["U-R4-001"],"route_ids":["route-research-again"],"metrics":{"transcript_dependency":0,"restart_from_zero":0,"duplicate_effect":0,"unsupported_assumption":0,"stale_state_adoption":0,"unnecessary_research":0,"duplicate_work":0,"correct_next_stage":true},"notes":"use persisted source-bound evidence; unnecessary re-research is zero"}
